{
  "section_id": "cdp",
  "paper_id": "practice-set-01",
  "name_en": "Child Development and Pedagogy",
  "name_hi": "बाल विकास एवं शिक्षण शास्त्र",
  "q_range": "1-30",
  "total_questions": 30,
  "kind": "original_practice",
  "extraction": null,
  "questions": [
    {
      "no": 1,
      "text": {
        "en": "An infant gains control over the head and face before gaining control over the arms and legs. This pattern of development is best explained by which principle?",
        "hi": "एक शिशु भुजाओं और टांगों पर नियंत्रण से पहले अपने सिर और चेहरे पर नियंत्रण प्राप्त करता है। विकास की यह प्रवृत्ति किस सिद्धांत द्वारा सर्वोत्तम रूप से समझाई जाती है?",
        "raw": null
      },
      "options": {
        "en": [
          "Cephalocaudal principle",
          "Proximodistal principle",
          "Hierarchical integration",
          "Independence of systems"
        ],
        "hi": [
          "सेफेलोकाउडल (सिर से पैर की ओर) सिद्धांत",
          "प्रोक्सिमोडिस्टल (मध्य से बाहर की ओर) सिद्धांत",
          "पदानुक्रमित एकीकरण",
          "तंत्रों की स्वतंत्रता"
        ],
        "raw": null
      },
      "answer": null,
      "explanation": null,
      "topic": null,
      "difficulty": null,
      "provenance": {
        "content_type": "original_practice",
        "session_id": null,
        "set_code": null,
        "source_file": null,
        "source_url": null,
        "page": null,
        "reuse_permission": "not_required",
        "notes": "Original question written for this repo (practice use)."
      }
    },
    {
      "no": 2,
      "text": {
        "en": "A child learns to control the movements of the whole arm before being able to pick up tiny objects with the fingers. This illustrates the:",
        "hi": "बच्चा उंगलियों से छोटी-छोटी वस्तुएँ उठाने में सक्षम होने से पहले पूरी भुजा की गतियों पर नियंत्रण करना सीखता है। यह किसका उदाहरण है?",
        "raw": null
      },
      "options": {
        "en": [
          "Cephalocaudal principle",
          "Proximodistal principle",
          "Principle of maturation only",
          "Principle of equilibrium"
        ],
        "hi": [
          "सेफेलोकाउडल सिद्धांत",
          "प्रोक्सिमोडिस्टल सिद्धांत",
          "केवल परिपक्वता का सिद्धांत",
          "संतुलन का सिद्धांत"
        ],
        "raw": null
      },
      "answer": null,
      "explanation": null,
      "topic": null,
      "difficulty": null,
      "provenance": {
        "content_type": "original_practice",
        "session_id": null,
        "set_code": null,
        "source_file": null,
        "source_url": null,
        "page": null,
        "reuse_permission": "not_required",
        "notes": "Original question written for this repo (practice use)."
      }
    },
    {
      "no": 3,
      "text": {
        "en": "A child says that the amount of water remains the same even after it is poured from a tall, narrow glass into a short, wide bowl. According to Piaget, this shows that the child has developed:",
        "hi": "एक बच्चा कहता है कि लंबे, पतले गिलास से पानी को छोटे, चौड़े कटोरे में डालने के बाद भी पानी की मात्रा उतनी ही रहती है। पियाजे के अनुसार, यह दर्शाता है कि बच्चे में किसका विकास हुआ है?",
        "raw": null
      },
      "options": {
        "en": [
          "Object permanence",
          "Egocentrism",
          "Conservation",
          "Animism"
        ],
        "hi": [
          "वस्तु स्थायित्व",
          "आत्मकेंद्रण",
          "संरक्षण",
          "जीववाद"
        ],
        "raw": null
      },
      "answer": null,
      "explanation": null,
      "topic": null,
      "difficulty": null,
      "provenance": {
        "content_type": "original_practice",
        "session_id": null,
        "set_code": null,
        "source_file": null,
        "source_url": null,
        "page": null,
        "reuse_permission": "not_required",
        "notes": "Original question written for this repo (practice use)."
      }
    },
    {
      "no": 4,
      "text": {
        "en": "According to Vygotsky, the 'Zone of Proximal Development' refers to:",
        "hi": "विगोत्स्की के अनुसार, 'समीपवर्ती विकास क्षेत्र' (Zone of Proximal Development) किसे कहते हैं?",
        "raw": null
      },
      "options": {
        "en": [
          "Tasks a child can complete completely independently",
          "Tasks a child cannot do even with help",
          "The gap between a child's independent performance and performance with guidance",
          "The stage of biological maturation"
        ],
        "hi": [
          "वे कार्य जो बच्चा पूरी तरह स्वतंत्र रूप से कर सकता है",
          "वे कार्य जो बच्चा सहायता मिलने पर भी नहीं कर सकता",
          "बच्चे के स्वतंत्र प्रदर्शन और मार्गदर्शन के साथ प्रदर्शन के बीच का अंतर",
          "जैविक परिपक्वता की अवस्था"
        ],
        "raw": null
      },
      "answer": null,
      "explanation": null,
      "topic": null,
      "difficulty": null,
      "provenance": {
        "content_type": "original_practice",
        "session_id": null,
        "set_code": null,
        "source_file": null,
        "source_url": null,
        "page": null,
        "reuse_permission": "not_required",
        "notes": "Original question written for this repo (practice use)."
      }
    },
    {
      "no": 5,
      "text": {
        "en": "A child follows classroom rules mainly to avoid the teacher's scolding. According to Kohlberg, this reflects moral reasoning at the:",
        "hi": "एक बच्चा मुख्य रूप से अध्यापक की डांट से बचने के लिए कक्षा के नियमों का पालन करता है। कोहलबर्ग के अनुसार, यह किस स्तर पर नैतिक तर्क को दर्शाता है?",
        "raw": null
      },
      "options": {
        "en": [
          "Post-conventional level",
          "Pre-conventional level",
          "Conventional level",
          "Universal ethical level"
        ],
        "hi": [
          "उत्तर-परंपरागत स्तर",
          "पूर्व-परंपरागत स्तर",
          "परंपरागत स्तर",
          "सार्वभौमिक नैतिक स्तर"
        ],
        "raw": null
      },
      "answer": null,
      "explanation": null,
      "topic": null,
      "difficulty": null,
      "provenance": {
        "content_type": "original_practice",
        "session_id": null,
        "set_code": null,
        "source_file": null,
        "source_url": null,
        "page": null,
        "reuse_permission": "not_required",
        "notes": "Original question written for this repo (practice use)."
      }
    },
    {
      "no": 6,
      "text": {
        "en": "A child can easily identify and classify plants, animals and natural patterns around her. According to Gardner's theory, she shows strong:",
        "hi": "एक बच्ची अपने आस-पास के पौधों, जंतुओं और प्राकृतिक पैटर्नों को आसानी से पहचान और वर्गीकृत कर सकती है। गार्डनर के सिद्धांत के अनुसार, उसमें किसकी प्रबलता है?",
        "raw": null
      },
      "options": {
        "en": [
          "Linguistic intelligence",
          "Logical-mathematical intelligence",
          "Spatial intelligence",
          "Naturalistic intelligence"
        ],
        "hi": [
          "भाषिक बुद्धि",
          "तार्किक-गणितीय बुद्धि",
          "स्थानिक बुद्धि",
          "प्रकृतिवादी (नेचुरलिस्टिक) बुद्धि"
        ],
        "raw": null
      },
      "answer": null,
      "explanation": null,
      "topic": null,
      "difficulty": null,
      "provenance": {
        "content_type": "original_practice",
        "session_id": null,
        "set_code": null,
        "source_file": null,
        "source_url": null,
        "page": null,
        "reuse_permission": "not_required",
        "notes": "Original question written for this repo (practice use)."
      }
    },
    {
      "no": 7,
      "text": {
        "en": "Which statement best describes 'inclusive education'?",
        "hi": "'समावेशी शिक्षा' का सर्वोत्तम वर्णन कौन-सा कथन करता है?",
        "raw": null
      },
      "options": {
        "en": [
          "Children with disabilities should study in separate special schools only",
          "All children learn together in the same classroom, with support for diverse needs",
          "Only gifted children should be admitted to regular schools",
          "Remedial coaching after school hours for slow learners"
        ],
        "hi": [
          "दिव्यांग बच्चों को केवल अलग विशेष विद्यालयों में पढ़ना चाहिए",
          "सभी बच्चे एक ही कक्षा में साथ-साथ सीखते हैं, विविध आवश्यकताओं के लिए सहायता दी जाती है",
          "सामान्य विद्यालयों में केवल प्रतिभाशाली बच्चों को प्रवेश मिलना चाहिए",
          "धीमे अधिगमकर्ताओं के लिए विद्यालय समय के बाद उपचारात्मक कोचिंग"
        ],
        "raw": null
      },
      "answer": null,
      "explanation": null,
      "topic": null,
      "difficulty": null,
      "provenance": {
        "content_type": "original_practice",
        "session_id": null,
        "set_code": null,
        "source_file": null,
        "source_url": null,
        "page": null,
        "reuse_permission": "not_required",
        "notes": "Original question written for this repo (practice use)."
      }
    },
    {
      "no": 8,
      "text": {
        "en": "A bright child struggles with accurate and fluent reading of words, often confusing letters such as 'b' and 'd'. This difficulty is most likely:",
        "hi": "एक होशियार बच्चा शब्दों को सटीक और प्रवाहमय रूप से पढ़ने में संघर्ष करता है और अक्सर 'ब' और 'द' जैसे अक्षरों में उलझ जाता है। यह कठिनाई सबसे अधिक संभावित रूप से क्या है?",
        "raw": null
      },
      "options": {
        "en": [
          "Dyslexia",
          "Dyscalculia",
          "Intellectual disability",
          "Hearing impairment"
        ],
        "hi": [
          "डिसलेक्सिया (पठन कठिनाई)",
          "डिसकैलकुलिया (गणन कठिनाई)",
          "बौद्धिक दिव्यांगता",
          "श्रवण दोष"
        ],
        "raw": null
      },
      "answer": null,
      "explanation": null,
      "topic": null,
      "difficulty": null,
      "provenance": {
        "content_type": "original_practice",